{
  "schemaVersion": "0.1.0",
  "findingId": "ofif-finding:oidc-broker-credential-stuffing-001",
  "findingRefs": [
    "ofif-observation:alpha-perimeter-scan-2026-06-28",
    "ofif-observation:broker-auth-log-anomaly-2026-06-28"
  ],
  "evidenceDigestRefs": [
    "digest:sha256:abc123def456789012345678901234567890123456789012345678901234abcd"
  ],
  "attackCoverageRefs": [
    "mitre:t1110-003",
    "mitre:t1078"
  ],
  "controlRefs": [
    "control:mfa-enforcement",
    "control:rate-limit-auth-endpoint"
  ],
  "severity": "high",
  "confidence": 0.87,
  "clientImpact": "Successful credential stuffing could allow adversary to impersonate legitimate users and access production workloads. Current MFA posture partially mitigates but rate-limiting gaps remain exploitable.",
  "recommendedActions": [
    "Enforce adaptive rate limiting on /auth/token endpoint (max 10 req/min per IP)",
    "Enable step-up MFA for logins originating from anonymous proxy ranges",
    "Rotate all service-account credentials issued before 2026-06-01"
  ],
  "proofRefs": [
    "proof:sha256:e3b0c44298fc1c149afbf4c8996fb92427ae41e4649b934ca495991b7852b855"
  ],
  "redactionState": "redacted",
  "disclosureClass": "client",
  "clientScope": "acme-corp",
  "tenantScope": "acme-corp:prod",
  "retentionPolicy": "retain-90d-then-purge",
  "authorizationRef": "authz:engagement-policy:acme-corp-phase4-2026",
  "executionPerformed": false
}
